image_name|comment_number|comment
1.jpg|0|가족 밥 식사 화목
2.jpg|0|가족 배구공 화목함 나들이
3.jpg|0|강아지 멍멍이 개 서로 다른 색
4.jpg|0|검정 고양이 책들 
5.jpg|0|계단 나무 빛나는
6.jpg|0|고슴도치 돌
7.jpg|0|고양이 돌 자연
8.jpg|0|고양이 어항 물고기
9.jpg|0|곰 아이 새 숲 나무
10.jpg|0|그네 달 아이 고양이 나무 풀
11.jpg|0|그네 밤하늘 별 달 보라색
12.jpg|0|꽃밭 황혼 구름 아름다운
13.jpg|0|나무 바람 아이
14.jpg|0|나뭇잎 나비
15.jpg|0|나비 꽃
16.jpg|0|남자 소년 상자 화목
17.jpg|0|남자 여자 축구공 축구
18.jpg|0|눈을 감는 여우 꽃
19.jpg|0|다람쥐 도도링 나뭇잎
20.jpg|0|다람쥐 봄 꽃들 귀여운 사랑스러운 달콤한
21.jpg|0|다리 나무 숲 강
22.jpg|0|달 별 밤 산 안개
23.jpg|0|달팽이 이끼 촉촉한 나무
24.jpg|0|닭 어린이 농장
25.jpg|0|동물 곰 새 우산
26.jpg|0|동물 곰 토끼 소 독서 책
27.jpg|0|바다 돌고래
28.jpg|0|바다 배 갈매기 달 노을 별
29.jpg|0|방 책장 카펫 장난감
30.jpg|0|병아리 초원 솜털 같은 새
31.jpg|0|북극곰 눈 크리스마스 달
32.jpg|0|북극곰 바다 수영
33.jpg|0|북극곰 산 바다 달 구름
34.jpg|0|북금곰 곰
35.jpg|0|빛나는 태양 나무 여성
36.jpg|0|사진 아이 부츠 길가
37.jpg|0|새 벚꽃
38.jpg|0|소녀 곱슬머리 지구 허그
39.jpg|0|소녀 공룡
40.jpg|0|소녀 네잎클로버 초록색
41.jpg|0|소녀 독서 나무 나비 동물
42.jpg|0|소녀 리본 숟가락 포크
43.jpg|0|소녀 수박 해 아이스크림
44.jpg|0|소녀 신남 점프 애완동물 안경
45.jpg|0|소녀 아이들 농구공 깃발
46.jpg|0|소녀 장난감 곰인형 상자
47.jpg|0|소녀 주황머리 책 독서
48.jpg|0|소녀 통나무 버섯 여우
49.jpg|0|소녀 화가 모자 붓
50.jpg|0|소년 곱슬머리 카메라 사진
51.jpg|0|소년 비행기 소풍 들판
52.jpg|0|소년 소녀 꽃 무지개 연
53.jpg|0|소년 소녀 눈사람 눈
54.jpg|0|소년 소녀 독서 필기 공부
55.jpg|0|소년 소녀 들판
56.jpg|0|소년 소녀 모자 요리사 케이크
57.jpg|0|소년 소녀 사랑 하트
58.jpg|0|소년 소녀 소풍 산책
59.jpg|0|소년 소녀 장난감 인형 주사위
60.jpg|0|소년 소녀 점프 풍선 들판
61.jpg|0|소년 소녀 축구 축구공 해
62.jpg|0|소년 소녀 탐험 깃발 지도 안경 돋보기
63.jpg|0|소년 애완동물 고양이 나뭇잎
64.jpg|0|소년 요술 용 지팡이
65.jpg|0|소년 웃음 연필 곱슬머리
66.jpg|0|소년 종이접기 종이비행기 꽃
67.jpg|0|소년 팔짱 가운
68.jpg|0|수박 잘 익은 맛있는 
69.jpg|0|아기 의사 청진기
70.jpg|0|아이 마루 집
71.jpg|0|아이들 나무 들판
72.jpg|0|아이들 나무 장갑
73.jpg|0|아이들 놀이터 미끄럼틀 시소 풍선
74.jpg|0|아이들 놀이터 미끄럼틀 애완동물
75.jpg|0|아이들 들판 물총 해
76.jpg|0|아이들 종이접기 단체
77.jpg|0|아이들 춤 신남
78.jpg|0|아이들 튜브 수영 바다
79.jpg|0|앉아있는 고양이 사람처럼 
80.jpg|0|어린이 늑대 숲 동화 어두운 밤 조명
81.jpg|0|어린이들 남자아이 낚시 취미 강 숲
82.jpg|0|얼음 얼음결정 차가운
83.jpg|0|엄마 소녀 허그 안경
84.jpg|0|여우 달 숲 별 뼈다귀
85.jpg|0|여자 곱슬머리 사과
86.jpg|0|여자 숲 꽃 토끼
87.jpg|0|열기구 집 동물 병아리 쥐 돼지 소 여우
88.jpg|0|오로라 눈 별 밤하늘 추운 밤 자연현상
89.jpg|0|웃는 아이 고양이 눈 숲
90.jpg|0|은하수 
91.jpg|0|작은 고양이 큰 고양이 흰 고양이
92.jpg|0|집 나무 꽃 구름
93.jpg|0|쿠키 우유 맛있는
94.jpg|0|토끼 배
95.jpg|0|토끼 토끼들 바이올렛 트럼펫 드럼
96.jpg|0|팽귄 사랑
97.jpg|0|할로윈 호박 고양이
98.jpg|0|해변 바다 햇빛 모래 해안 해안선 거품 황혼
99.jpg|0|해적 앵무새 나무 섬 해적섬
100.jpg|0|흰색 말 자연 숲속 햇빛
